{
  "schemaVersion": "abraxas.job.v2",
  "id": "adcc5405-a109-4df8-8d99-93be43a327fe",
  "projectId": "aaf23143-203c-42ce-baa5-3c1a911fedc8",
  "kind": "project.validate",
  "handler": "project.validate",
  "status": "queued",
  "inputFingerprint": "fixture-only",
  "input": {
    "name": "JOC \u00b7 Fixture",
    "graph": {
      "schemaVersion": "abraxas.production-graph.v2",
      "projectId": "aaf23143-203c-42ce-baa5-3c1a911fedc8",
      "timebase": {
        "fpsNumerator": 30000,
        "fpsDenominator": 1001
      },
      "events": [
        {
          "id": "A01",
          "kind": "a_roll",
          "startFrame": 0,
          "endFrame": 1800,
          "status": "approved",
          "assetRefs": [
            "master"
          ]
        },
        {
          "id": "BR03",
          "kind": "b_roll",
          "startFrame": 440,
          "endFrame": 615,
          "status": "planned",
          "visualTypeId": "broll.editorial-photo.v1",
          "assetRefs": [],
          "extensions": {
            "abraxas.broll.editorial-photo@1": {
              "motion": "push_in_soft"
            }
          }
        }
      ]
    }
  },
  "sourceRevision": 0,
  "progress": 0,
  "attempt": 0,
  "maxAttempts": 3,
  "createdAt": "2026-10-02T20:00:00.000Z",
  "updatedAt": "2026-10-02T20:00:00.000Z"
}
